{"$schema":"http://json-schema.org/draft-07/schema#","$id":"https://contracts.agentops.dev/observation/fixture-case-0.1.0.schema.json","type":"object","additionalProperties":false,"required":["fixture_version","case_id","category","input","expected"],"properties":{"fixture_version":{"const":"0.1.0"},"case_id":{"type":"string","pattern":"^[a-z0-9][a-z0-9.-]{0,127}$"},"category":{"enum":["positive","negative","base-endpoint","multi-target","duplicate-conflict","partial-success","sampling","privacy","lineage","crash-recovery","completeness","usage","retention"]},"input":{"type":"object"},"expected":{"type":"object","additionalProperties":false,"required":["decision"],"properties":{"decision":{"enum":["ACCEPT","REJECT","PARTIAL_SUCCESS","NO_OP","CONFLICT","RETRY","RETAIN","DELETE"]},"accepted":{"type":"integer","minimum":0},"rejected":{"type":"integer","minimum":0},"reason":{"type":"string","minLength":1,"maxLength":256}}}}}
