{"fixture_version":"0.1.0","case_id":"duplicate-conflict.changed-payload","category":"duplicate-conflict","input":{"identity_sequence":true,"records":[{"profile_version":"0.3.0","record_type":"event","event_name":"sampling.decision","resource":{"service.name":"dsh","service.version":"1"},"scope":{"name":"io.agentops.dsh.observation","version":"0.3.0","schema_url":"https://opentelemetry.io/schemas/1.41.0"},"attributes":{"agentops.event.id":"event-d2","agentops.sampling.decision":"RECORD_AND_SAMPLE","agentops.sampling.probability":1}},{"profile_version":"0.3.0","record_type":"event","event_name":"sampling.decision","resource":{"service.name":"dsh","service.version":"1"},"scope":{"name":"io.agentops.dsh.observation","version":"0.3.0","schema_url":"https://opentelemetry.io/schemas/1.41.0"},"attributes":{"agentops.event.id":"event-d2","agentops.sampling.decision":"DROP","agentops.sampling.probability":0}}]},"expected":{"decision":"CONFLICT"}}
