{"fixture_version":"0.1.0","case_id":"crash-recovery.otlp-timeout","category":"crash-recovery","input":{"interaction":{"interaction_version":"1.0.0","base_url":"http://127.0.0.1:4318","request":{"carrier":"OTLP_HTTP_PROTOBUF","content_type":"application/x-protobuf","signal":"traces","path":"/v1/traces","record_count":1,"encoded_bytes":128,"profile_version":"1.0.0","family_schema":"implementation@1","attempt":1},"transport_result":{"kind":"NO_HTTP_RESPONSE","failure":"TIMEOUT","retry_class":"RETRY_IDENTICAL"}}},"expected":{"decision":"ACCEPT"}}
