{"fixture_version":"0.1.0","case_id":"partial-success.otlp-mixed","category":"partial-success","input":{"interaction":{"interaction_version":"1.0.0","base_url":"http://[::1]:4318","request":{"carrier":"OTLP_HTTP_PROTOBUF","content_type":"application/x-protobuf","signal":"logs","path":"/v1/logs","record_count":3,"encoded_bytes":512,"profile_version":"1.0.0","family_schema":"system-design@1","attempt":1},"transport_result":{"kind":"HTTP_RESPONSE","http_status":200,"body_kind":"EXPORT_RESPONSE","rejected_log_records":2}}},"expected":{"decision":"ACCEPT"}}
