{"fixture_version":"0.1.0","case_id":"usage.provider-money","category":"usage","input":{"records":[{"profile_version":"0.3.0","record_type":"event","event_name":"usage","resource":{"service.name":"dsh","service.version":"1"},"scope":{"name":"io.agentops.dsh.observation","version":"0.3.0","schema_url":"https://opentelemetry.io/schemas/1.41.0"},"attributes":{"agentops.event.id":"event-u1","agentops.workflow.family":"implementation","agentops.family.schema":"implementation@1","agentops.summary.state":"FINAL","agentops.usage.kind":"money","agentops.usage.unit":"CNY","agentops.usage.source":"provider","agentops.usage.source.id":"deepseek","agentops.usage.value":125}}]},"expected":{"decision":"ACCEPT"}}
