{"fixture_version":"0.1.0","case_id":"duplicate-conflict.span-changed-same-batch","category":"duplicate-conflict","input":{"identity_sequence":true,"records":[{"profile_version":"1.0.0","record_type":"span","span_name":"chat deepseek","trace_id":"11111111111111111111111111111111","span_id":"2222222222222222","resource":{"service.name":"dsh","service.version":"1"},"scope":{"name":"io.agentops.dsh.observation","version":"1.0.0","schema_url":"https://opentelemetry.io/schemas/1.41.0"},"attributes":{"gen_ai.operation.name":"chat","gen_ai.provider.name":"deepseek","gen_ai.request.model":"deepseek-chat","agentops.model.id":"deepseek-chat","agentops.role.id":"implementer","agentops.runtime.id":"deepseek-harness"}},{"profile_version":"1.0.0","record_type":"span","span_name":"chat deepseek","trace_id":"11111111111111111111111111111111","span_id":"2222222222222222","resource":{"service.name":"dsh","service.version":"1"},"scope":{"name":"io.agentops.dsh.observation","version":"1.0.0","schema_url":"https://opentelemetry.io/schemas/1.41.0"},"attributes":{"gen_ai.operation.name":"chat","gen_ai.provider.name":"deepseek","gen_ai.request.model":"deepseek-reasoner","agentops.model.id":"deepseek-reasoner","agentops.role.id":"implementer","agentops.runtime.id":"deepseek-harness"}}]},"expected":{"decision":"CONFLICT"}}
