{
  "fixture_version": "0.1.0",
  "case_id": "positive.finding-fix-recheck",
  "category": "positive",
  "input": {
    "identity_sequence": true,
    "records": [
      {
        "profile_version":"0.3.0","record_type":"event","event_name":"review.finding",
        "resource":{"service.name":"dsh","service.version":"1"},
        "scope":{"name":"io.agentops.dsh.observation","version":"0.3.0","schema_url":"https://opentelemetry.io/schemas/1.41.0"},
        "attributes":{"agentops.event.id":"event-f3","agentops.workflow.family":"implementation","agentops.family.schema":"implementation@1","agentops.review.id":"review-source","agentops.review.lens":"IMPLEMENTATION_WHITEBOX","agentops.review.scope":"WHOLE_SCOPE","agentops.review.severity":"MAJOR","agentops.finding.id":"finding-3","agentops.finding.status":"OPEN","agentops.source.review.id":"review-source","agentops.artifact.id":"artifact-3","agentops.artifact.digest":"3333333333333333333333333333333333333333333333333333333333333333","agentops.writer.role.id":"writer","agentops.writer.invocation.id":"writer-invocation-3","agentops.reviewer.role.id":"reviewer","agentops.reviewer.invocation.id":"reviewer-invocation-3","agentops.finding.summary":"The assertion needs a lifecycle check","agentops.finding.scope.id":"scope-3","agentops.finding.target.kind":"ARTIFACT","agentops.finding.target.id":"artifact-3"}
      },
      {
        "profile_version":"0.3.0","record_type":"event","event_name":"review.finding",
        "resource":{"service.name":"dsh","service.version":"1"},
        "scope":{"name":"io.agentops.dsh.observation","version":"0.3.0","schema_url":"https://opentelemetry.io/schemas/1.41.0"},
        "attributes":{"agentops.event.id":"event-f4","agentops.workflow.family":"implementation","agentops.family.schema":"implementation@1","agentops.review.id":"review-fix","agentops.review.lens":"IMPLEMENTATION_WHITEBOX","agentops.review.scope":"WHOLE_SCOPE","agentops.review.severity":"MAJOR","agentops.finding.id":"finding-3","agentops.finding.status":"CLOSED_FIXED","agentops.source.review.id":"review-source","agentops.artifact.id":"artifact-3","agentops.artifact.digest":"3333333333333333333333333333333333333333333333333333333333333333","agentops.writer.role.id":"writer","agentops.writer.invocation.id":"writer-invocation-4","agentops.reviewer.role.id":"reviewer","agentops.reviewer.invocation.id":"reviewer-invocation-4","agentops.finding.summary":"The assertion needs a lifecycle check","agentops.finding.scope.id":"scope-3","agentops.finding.target.kind":"ARTIFACT","agentops.finding.target.id":"artifact-3","agentops.fix.id":"fix-1","agentops.fix.finding.id":"finding-3"}
      },
      {
        "profile_version":"0.3.0","record_type":"event","event_name":"review.finding",
        "resource":{"service.name":"dsh","service.version":"1"},
        "scope":{"name":"io.agentops.dsh.observation","version":"0.3.0","schema_url":"https://opentelemetry.io/schemas/1.41.0"},
        "attributes":{"agentops.event.id":"event-f5","agentops.workflow.family":"implementation","agentops.family.schema":"implementation@1","agentops.review.id":"review-recheck","agentops.review.lens":"IMPLEMENTATION_WHITEBOX","agentops.review.scope":"WHOLE_SCOPE","agentops.review.severity":"MAJOR","agentops.finding.id":"finding-3","agentops.finding.status":"CLOSED_FIXED","agentops.source.review.id":"review-source","agentops.artifact.id":"artifact-3","agentops.artifact.digest":"3333333333333333333333333333333333333333333333333333333333333333","agentops.writer.role.id":"writer","agentops.writer.invocation.id":"writer-invocation-5","agentops.reviewer.role.id":"reviewer","agentops.reviewer.invocation.id":"reviewer-invocation-5","agentops.finding.summary":"The assertion needs a lifecycle check","agentops.finding.scope.id":"scope-3","agentops.finding.target.kind":"ARTIFACT","agentops.finding.target.id":"artifact-3","agentops.recheck.id":"recheck-1","agentops.recheck.review.id":"review-source","agentops.recheck.finding.id":"finding-3","agentops.recheck.fix.id":"fix-1","agentops.iteration.id":"iteration-1","agentops.recheck.role.id":"rechecker","agentops.recheck.invocation.id":"recheck-invocation-1"}
      }
    ]
  },
  "expected": { "decision": "ACCEPT" }
}
