{"fixture_version":"0.1.0","case_id":"partial-success.mixed-batch","category":"partial-success","input":{"records":[{"profile_version":"1.0.0","record_type":"event","event_name":"sampling.decision","resource":{"service.name":"dsh","service.version":"1"},"scope":{"name":"io.agentops.dsh.observation","version":"1.0.0","schema_url":"https://opentelemetry.io/schemas/1.41.0"},"attributes":{"agentops.event.id":"event-p1","agentops.sampling.decision":"DROP","agentops.sampling.probability":0}},{"profile_version":"1.0.0","record_type":"event","event_name":"sampling.decision","resource":{"service.name":"dsh","service.version":"1"},"scope":{"name":"io.agentops.dsh.observation","version":"1.0.0","schema_url":"https://opentelemetry.io/schemas/1.41.0"},"attributes":{"agentops.event.id":"event-p2","agentops.invalid.reason":"bad","agentops.sampling.decision":"DROP","agentops.sampling.probability":0}}]},"expected":{"decision":"PARTIAL_SUCCESS","accepted":1,"rejected":1}}
