{"fixture_version":"0.1.0","case_id":"positive.otlp-empty-success","category":"positive","input":{"interaction":{"interaction_version":"1.0.0","base_url":"http://127.0.0.1:4318","request":{"carrier":"OTLP_HTTP_PROTOBUF","content_type":"application/x-protobuf","signal":"logs","path":"/v1/logs","record_count":0,"encoded_bytes":0,"profile_version":"1.0.0","family_schema":"implementation@1","attempt":1},"transport_result":{"kind":"HTTP_RESPONSE","http_status":200,"body_kind":"EXPORT_RESPONSE"}}},"expected":{"decision":"ACCEPT"}}
