{"fixture_version":"0.1.0","case_id":"multi-target.two-sections","category":"multi-target","input":{"identity_sequence":true,"records":[{"profile_version":"0.3.0","record_type":"event","event_name":"review.finding","resource":{"service.name":"dsh","service.version":"1"},"scope":{"name":"io.agentops.dsh.observation","version":"0.3.0","schema_url":"https://opentelemetry.io/schemas/1.41.0"},"attributes":{"agentops.event.id":"event-m1","agentops.workflow.family":"system-design","agentops.family.schema":"system-design@1","agentops.review.id":"review-2","agentops.review.lens":"ARCHITECTURE","agentops.review.scope":"SYSTEM_DESIGN","agentops.review.severity":"MAJOR","agentops.finding.id":"finding-2","agentops.finding.status":"OPEN","agentops.source.review.id":"review-2","agentops.artifact.id":"artifact-2","agentops.artifact.digest":"eeeeeeeeeeeeeeeeeeeeeeeeeeeeeeeeeeeeeeeeeeeeeeeeeeeeeeeeeeeeeeee","agentops.writer.role.id":"writer","agentops.writer.invocation.id":"writer-invocation-2","agentops.reviewer.role.id":"reviewer","agentops.reviewer.invocation.id":"invocation-2","agentops.finding.summary":"One finding affects two sections","agentops.finding.scope.id":"scope-2","agentops.finding.target.kind":"SECTION","agentops.finding.target.id":"section-a","agentops.finding.target.artifact.id":"artifact-2"}},{"profile_version":"0.3.0","record_type":"event","event_name":"review.finding","resource":{"service.name":"dsh","service.version":"1"},"scope":{"name":"io.agentops.dsh.observation","version":"0.3.0","schema_url":"https://opentelemetry.io/schemas/1.41.0"},"attributes":{"agentops.event.id":"event-m2","agentops.workflow.family":"system-design","agentops.family.schema":"system-design@1","agentops.review.id":"review-2","agentops.review.lens":"ARCHITECTURE","agentops.review.scope":"SYSTEM_DESIGN","agentops.review.severity":"MAJOR","agentops.finding.id":"finding-2","agentops.finding.status":"OPEN","agentops.source.review.id":"review-2","agentops.artifact.id":"artifact-2","agentops.artifact.digest":"eeeeeeeeeeeeeeeeeeeeeeeeeeeeeeeeeeeeeeeeeeeeeeeeeeeeeeeeeeeeeeee","agentops.writer.role.id":"writer","agentops.writer.invocation.id":"writer-invocation-2","agentops.reviewer.role.id":"reviewer","agentops.reviewer.invocation.id":"invocation-2","agentops.finding.summary":"One finding affects two sections","agentops.finding.scope.id":"scope-2","agentops.finding.target.kind":"SECTION","agentops.finding.target.id":"section-b","agentops.finding.target.artifact.id":"artifact-2"}}]},"expected":{"decision":"ACCEPT"}}
