{
  "fixture_version": "0.1.0",
  "case_id": "duplicate-conflict.span-identical-same-batch",
  "category": "duplicate-conflict",
  "input": {
    "identity_sequence": true,
    "records": [
      {
        "profile_version": "1.0.0",
        "record_type": "span",
        "span_name": "invoke_workflow delivery-1",
        "trace_id": "11111111111111111111111111111111",
        "span_id": "1111111111111111",
        "resource": {
          "service.name": "dsh",
          "service.version": "1"
        },
        "scope": {
          "name": "io.agentops.dsh.observation",
          "version": "1.0.0",
          "schema_url": "https://opentelemetry.io/schemas/1.41.0"
        },
        "attributes": {
          "agentops.delivery.id": "delivery-1",
          "agentops.workflow.id": "workflow-1",
          "agentops.workflow.version": "1",
          "agentops.implementation.id": "implementation-1",
          "agentops.runtime.id": "deepseek-harness",
          "agentops.manifest.digest": "aaaaaaaaaaaaaaaaaaaaaaaaaaaaaaaaaaaaaaaaaaaaaaaaaaaaaaaaaaaaaaaa",
          "agentops.workflow.family": "implementation"
        }
      },
      {
        "profile_version": "1.0.0",
        "record_type": "span",
        "span_name": "chat deepseek",
        "trace_id": "11111111111111111111111111111111",
        "span_id": "2222222222222222",
        "resource": {
          "service.name": "dsh",
          "service.version": "1"
        },
        "scope": {
          "name": "io.agentops.dsh.observation",
          "version": "1.0.0",
          "schema_url": "https://opentelemetry.io/schemas/1.41.0"
        },
        "attributes": {
          "gen_ai.operation.name": "chat",
          "gen_ai.provider.name": "deepseek",
          "gen_ai.request.model": "deepseek-chat",
          "agentops.model.id": "deepseek-chat",
          "agentops.role.id": "implementer",
          "agentops.runtime.id": "deepseek-harness"
        }
      },
      {
        "profile_version": "1.0.0",
        "record_type": "span",
        "span_name": "chat deepseek",
        "trace_id": "11111111111111111111111111111111",
        "span_id": "2222222222222222",
        "resource": {
          "service.name": "dsh",
          "service.version": "1"
        },
        "scope": {
          "name": "io.agentops.dsh.observation",
          "version": "1.0.0",
          "schema_url": "https://opentelemetry.io/schemas/1.41.0"
        },
        "attributes": {
          "gen_ai.operation.name": "chat",
          "gen_ai.provider.name": "deepseek",
          "gen_ai.request.model": "deepseek-chat",
          "agentops.model.id": "deepseek-chat",
          "agentops.role.id": "implementer",
          "agentops.runtime.id": "deepseek-harness"
        }
      }
    ]
  },
  "expected": {
    "decision": "NO_OP"
  }
}
