{"fixture_version":"0.1.0","case_id":"lineage.known","category":"lineage","input":{"records":[{"profile_version":"0.3.0","record_type":"event","event_name":"role.lineage","resource":{"service.name":"dsh","service.version":"1"},"scope":{"name":"io.agentops.dsh.observation","version":"0.3.0","schema_url":"https://opentelemetry.io/schemas/1.41.0"},"attributes":{"agentops.event.id":"event-l1","agentops.workflow.family":"implementation","agentops.family.schema":"implementation@1","agentops.role.id":"reviewer","agentops.role.lineage.id":"reviewer-v1"}}]},"expected":{"decision":"ACCEPT"}}
