{"fixture_version":"0.1.0","case_id":"positive.otlp-full-success","category":"positive","input":{"interaction":{"interaction_version":"1.0.0","base_url":"http://127.0.0.1:4318","request":{"carrier":"OTLP_HTTP_PROTOBUF","content_type":"application/x-protobuf","signal":"traces","path":"/v1/traces","record_count":2,"encoded_bytes":256,"profile_version":"1.0.0","family_schema":"implementation@1","attempt":1},"transport_result":{"kind":"HTTP_RESPONSE","http_status":200,"body_kind":"EXPORT_RESPONSE"}}},"expected":{"decision":"ACCEPT"}}
