{"fixture_version":"0.1.0","case_id":"sampling.default-head","category":"sampling","input":{"records":[{"profile_version":"0.3.0","record_type":"event","event_name":"sampling.decision","resource":{"service.name":"dsh","service.version":"1"},"scope":{"name":"io.agentops.dsh.observation","version":"0.3.0","schema_url":"https://opentelemetry.io/schemas/1.41.0"},"attributes":{"agentops.event.id":"event-s1","agentops.sampling.decision":"RECORD_AND_SAMPLE","agentops.sampling.probability":1}}]},"expected":{"decision":"ACCEPT"}}
