{"fixture_version":"0.1.0","case_id":"completeness.absent-observed-count","category":"completeness","input":{"records":[{"profile_version":"0.3.0","record_type":"event","event_name":"review.summary","resource":{"service.name":"dsh","service.version":"1"},"scope":{"name":"io.agentops.dsh.observation","version":"0.3.0","schema_url":"https://opentelemetry.io/schemas/1.41.0"},"attributes":{"agentops.event.id":"event-c1","agentops.workflow.family":"system-design","agentops.family.schema":"system-design@1","agentops.review.id":"review-3","agentops.review.lens":"FRESH_READER","agentops.review.scope":"SYSTEM_DESIGN","agentops.summary.state":"UNAVAILABLE","agentops.artifact.id":"artifact-3","agentops.artifact.digest":"ffffffffffffffffffffffffffffffffffffffffffffffffffffffffffffffff","agentops.writer.role.id":"writer","agentops.writer.invocation.id":"writer-invocation-3","agentops.reviewer.role.id":"reviewer","agentops.reviewer.invocation.id":"invocation-3","agentops.fresh_reader.result":"PASS","agentops.fresh_reader.finding.count":0}}]},"expected":{"decision":"ACCEPT"}}
