{"fixture_version":"0.1.0","case_id":"base-endpoint.artifact-target","category":"base-endpoint","input":{"records":[{"profile_version":"1.0.0","record_type":"event","event_name":"review.finding","resource":{"service.name":"dsh","service.version":"1"},"scope":{"name":"io.agentops.dsh.observation","version":"1.0.0","schema_url":"https://opentelemetry.io/schemas/1.41.0"},"attributes":{"agentops.event.id":"event-f1","agentops.workflow.family":"system-design","agentops.family.schema":"system-design@1","agentops.review.id":"review-1","agentops.review.lens":"FRESH_READER","agentops.review.scope":"SYSTEM_DESIGN","agentops.review.severity":"MAJOR","agentops.finding.id":"finding-1","agentops.finding.status":"OPEN","agentops.source.review.id":"review-1","agentops.artifact.id":"artifact-1","agentops.artifact.digest":"dddddddddddddddddddddddddddddddddddddddddddddddddddddddddddddddd","agentops.writer.role.id":"writer","agentops.writer.invocation.id":"writer-invocation-1","agentops.reviewer.role.id":"reviewer","agentops.reviewer.invocation.id":"invocation-1","agentops.finding.summary":"Missing ownership edge","agentops.finding.scope.id":"scope-1","agentops.finding.target.kind":"ARTIFACT","agentops.finding.target.id":"artifact-1"}}]},"expected":{"decision":"ACCEPT"}}
