{"fixture_version":"0.1.0","case_id":"crash-recovery.ambiguous-result","category":"crash-recovery","input":{"lifecycle_result":{"result_version":"0.1.0","delivery_id":"delivery-2","manifest_digest":"cccccccccccccccccccccccccccccccccccccccccccccccccccccccccccccccc","state":"RESULT_UNRESOLVED","diagnostic_reason":"Runtime result is invalid or ambiguous"}},"expected":{"decision":"RETAIN","reason":"remain occupied for inspection or reconciliation; never blind-retry Runtime"}}
